{
  "project_id": "taobao-12-no-threshold-redpacket",
  "category": "西瓜",
  "platform": "淘宝闪购",
  "campaign_name": "12元利益点",
  "benefit_points": [
    {
      "id": "primary-benefit",
      "text": "最高12元无门槛红包",
      "required": true,
      "exact_match": true,
      "no_split": false,
      "priority": 1
    }
  ],
  "no_split_phrases": [
    "淘宝闪购有最高12元无门槛红包"
  ],
  "campaign_forbidden_expressions": [
    "最高25元无门槛红包"
  ],
  "required_disclosures": [],
  "validation_config_path": "../validation/strict-default.json",
  "language_style": {
    "name": "need-first-infeed-conversational",
    "tone": "普通人先遇到一个真实生活需求或小麻烦，准备解决时顺手用了淘宝闪购；红包只是让这次购买更顺手，不是凭空制造需求的理由",
    "point_of_view": "像不同生活状态的人在和朋友分享一次真实补货、解馋、解腻或省事经历，先讲自己的处境，再自然提到淘宝闪购",
    "sentence_style": "每条开头都要换一种钩子，可以吐槽、发现、共鸣或即时情绪；句子短、口语化、有动作画面，不使用商品详情页语气",
    "emphasis": [
      "前三秒先写生活矛盾或情绪钩子，再出现商品和平台；不要以“我在淘宝闪购看某商品”作为故事起点",
      "文案逻辑必须是生活需求占主要原因、准备购买或解决问题在前、发现最高12元无门槛红包在后；红包只做促成购买的补充理由",
      "不同商品要匹配不同人群、生活事件和表达方式，例如懒人、宝妈、上班族、租房党、精打细算型、爱整洁型，批量生成时不得像同一个人换商品",
      "优先写高频生活细节和镜头动作；美食写打开、咬一口、叉起来、递给家人，水果写刚从冰箱拿出、饭后分着吃，抽纸等日用品写抽一张、擦一下、顺手扔掉",
      "商品名称、购买理由和使用方式应清楚可听，但不要连续介绍放哪里、怎么用、有什么用途；先让用户觉得“这说的不就是我吗”",
      "收尾落在生活状态或习惯上，例如家里不断货、下班少跑一趟、饭后舒服一下、现在基本都这样补货，不要停在商品形容词或泛泛省心"
    ],
    "avoid_phrases": [
      "我在淘宝闪购看",
      "在淘宝闪购看到",
      "看到红包就买了",
      "看到红包就下单",
      "打开淘宝闪购看",
      "临时想买又怕麻烦",
      "不知道怎么选",
      "拿起来就能用",
      "放着也方便",
      "红包直接抵扣",
      "补一个挺省心",
      "日常使用很合适",
      "擦键盘边",
      "擦粉扑盒",
      "红瓤看着清爽",
      "包装不占视线",
      "不占视线",
      "不突兀",
      "看着清爽",
      "食欲十足",
      "果肉清甜、多汁、解腻",
      "以前……后来……",
      "之前……直到……",
      "自从用了……",
      "真后悔没早点……",
      "买它真的很划算",
      "值得入手",
      "生活必备"
    ],
    "extra_rules": [
      "数字人口播时眼睛必须直视镜头，保持自然稳定的镜头交流感",
      "统一采用“钩子/共鸣-生活矛盾-原本打算-自然植入淘宝闪购和利益点-商品动作体验-情绪或习惯收尾”的信息流逻辑，但每条文案的开头、人设、事件和表达方式必须明显不同",
      "平台必须后置为解决方案：先有家里缺、嘴巴干、下班累、饭后想解腻、桌子擦不干净等需求，再写结果打开淘宝闪购或顺手用淘宝闪购解决",
      "利益点自然嵌入购买动作，占比要轻；不要写成“看到红包所以买”，也不要让红包成为唯一购买理由",
      "可以比普通聊天更有吸引力，但不得使用夸张喊麦、强行动引导或未确认的产地、规格、价格、销量、配送承诺",
      "仅有品类时，只能使用该品类层面的可观察体验、常见使用方式和合理生活场景，不能把生成内容反推成商品事实",
      "不要把某一类商品的动作套到其他品类；水果、美食、日用品、家清个护等品类都要各自匹配真实使用动作",
      "多写人的感受和结果，例如第一口舒服、一口接一口、终于不用跑超市、真省事；少写书面化商品形容词"
    ]
  }
}
